{
  "schemaVersion": 1,
  "profile": "yimi-system-boundaries-v1",
  "objective": {
    "reuseStrategy": "stable-kernel-ports-adapters",
    "maintenanceStrategy": "single-owner-contracts-and-conformance",
    "abstractionGate": "extract-after-second-real-consumer"
  },
  "nodeWorkspaces": [
    {
      "name": "@yimi-pen/core",
      "root": "packages/core",
      "role": "stable-core",
      "allowedInternalDependencies": [],
      "allowNodeBuiltins": false
    },
    {
      "name": "@yimi-pen/audio",
      "root": "packages/audio",
      "role": "stable-capability",
      "allowedInternalDependencies": [
        "@yimi-pen/core"
      ],
      "allowNodeBuiltins": true
    },
    {
      "name": "@yimi-pen/content",
      "root": "packages/content",
      "role": "stable-capability",
      "allowedInternalDependencies": [
        "@yimi-pen/core"
      ],
      "allowNodeBuiltins": true
    },
    {
      "name": "@yimi-pen/protocol",
      "root": "packages/protocol",
      "role": "stable-capability",
      "allowedInternalDependencies": [],
      "allowNodeBuiltins": false
    },
    {
      "name": "@yimi-pen/admin-web",
      "root": "apps/admin-web",
      "role": "composition-root",
      "allowedInternalDependencies": [
        "@yimi-pen/content",
        "@yimi-pen/core"
      ],
      "allowNodeBuiltins": true
    },
    {
      "name": "@yimi-pen/companion-app",
      "root": "apps/companion-app",
      "role": "composition-root",
      "allowedInternalDependencies": [
        "@yimi-pen/audio"
      ],
      "allowedCompositionImports": [
        "contracts",
        "scripts/snapshot-jcs.mjs",
        "tools/confirmation-trust",
        "tools/family-alpha-compiler",
        "tools/family-build-adapter",
        "tools/family-repository"
      ],
      "allowNodeBuiltins": true
    },
    {
      "name": "@yimi-pen/device-sim",
      "root": "apps/device-sim",
      "role": "composition-root",
      "allowedInternalDependencies": [
        "@yimi-pen/audio",
        "@yimi-pen/content",
        "@yimi-pen/core",
        "@yimi-pen/protocol"
      ],
      "allowNodeBuiltins": true
    }
  ],
  "rustWorkspace": {
    "manifest": "firmware/Cargo.toml",
    "crates": [
      {
        "name": "yimi-fw-contract",
        "root": "firmware/crates/yimi-fw-contract",
        "allowedProductionPathDependencies": [],
        "allowExternalProductionDependencies": false
      },
      {
        "name": "yimi-snapshot-core",
        "root": "firmware/crates/yimi-snapshot-core",
        "allowedProductionPathDependencies": [
          "yimi-fw-contract"
        ],
        "allowExternalProductionDependencies": false
      },
      {
        "name": "yimi-runtime-core",
        "root": "firmware/crates/yimi-runtime-core",
        "allowedProductionPathDependencies": [
          "yimi-fw-contract"
        ],
        "allowExternalProductionDependencies": false
      },
      {
        "name": "yimi-device-link-core",
        "root": "firmware/crates/yimi-device-link-core",
        "allowedProductionPathDependencies": [
          "yimi-fw-contract",
          "yimi-snapshot-core"
        ],
        "allowExternalProductionDependencies": false
      },
      {
        "name": "yimi-platform-ffi",
        "root": "firmware/crates/yimi-platform-ffi",
        "allowedProductionPathDependencies": [
          "yimi-fw-contract"
        ],
        "allowExternalProductionDependencies": false
      },
      {
        "name": "yimi-fw-host",
        "root": "firmware/crates/yimi-fw-host",
        "allowedProductionPathDependencies": [
          "yimi-device-link-core",
          "yimi-fw-contract",
          "yimi-runtime-core",
          "yimi-snapshot-core"
        ],
        "allowExternalProductionDependencies": true
      }
    ],
    "pureCoreCrates": [
      "yimi-fw-contract",
      "yimi-snapshot-core",
      "yimi-runtime-core",
      "yimi-device-link-core"
    ],
    "hostOnlyCrates": [
      "yimi-fw-host"
    ],
    "ffiBoundaryCrates": [
      "yimi-platform-ffi"
    ],
    "allowedUnsafeRustFiles": [
      "firmware/crates/yimi-platform-ffi/src/raw.rs"
    ],
    "forbiddenVendorTokensInPureCore": [
      "esp_idf",
      "freertos",
      "nuttx",
      "openvela",
      "embassy_executor",
      "stm32_hal"
    ]
  },
  "contractOwners": [
    {
      "id": "golden-24-v1",
      "canonicalPaths": [
        "hardware/evt0/golden-24/codes.json"
      ],
      "consumers": [
        "scripts/generate-golden-24-projection.mjs",
        "hardware/evt0/snapshot-v1/design",
        "hardware/evt0/family-alpha-v1/golden"
      ],
      "conformanceGate": "npm run validate:golden-24-projection"
    },
    {
      "id": "snapshot-v1",
      "canonicalPaths": [
        "hardware/evt0/snapshot-v1/schema.json",
        "hardware/evt0/snapshot-v1/logical-index.schema.json",
        "hardware/evt0/snapshot-v1/actions.schema.json",
        "hardware/evt0/snapshot-v1/operation-transcript.schema.json",
        "hardware/evt0/snapshot-v1/operation-transcript.json"
      ],
      "consumers": [
        "scripts/snapshot-projection-validator.mjs",
        "tools/snapshot-sim",
        "firmware/crates/yimi-snapshot-core"
      ],
      "conformanceGate": "npm run test:snapshot-sim"
    },
    {
      "id": "execution-model-v1",
      "canonicalPaths": [
        "hardware/evt0/execution-model-v1/execution-model.schema.json",
        "hardware/evt0/execution-model-v1/execution-result.schema.json",
        "hardware/evt0/execution-model-v1/execution-transcript.schema.json",
        "hardware/evt0/execution-model-v1/family-alpha-transcript.json",
        "hardware/evt0/execution-model-v1/golden-24-transcript.json",
        "hardware/evt0/execution-model-v1/order-trap/logical-index.json",
        "hardware/evt0/execution-model-v1/order-trap/actions.json",
        "hardware/evt0/execution-model-v1/order-trap-transcript.json"
      ],
      "consumers": [
        "tools/execution-model",
        "firmware/crates/yimi-runtime-core",
        "firmware/crates/yimi-fw-host"
      ],
      "conformanceGate": "npm run test:execution-model"
    },
    {
      "id": "weighted-random-v2",
      "canonicalPaths": [
        "hardware/evt0/weighted-random-v2/transcript.schema.json",
        "hardware/evt0/weighted-random-v2/result.schema.json",
        "hardware/evt0/weighted-random-v2/golden-transcript.json",
        "hardware/evt0/weighted-random-v2/evidence-lock.schema.json",
        "hardware/evt0/weighted-random-v2/evidence-lock.json"
      ],
      "consumers": [
        "tools/weighted-random",
        "firmware/crates/yimi-runtime-core",
        "firmware/crates/yimi-fw-host"
      ],
      "conformanceGate": "npm run test:weighted-random-v2"
    },
    {
      "id": "device-link-v1",
      "canonicalPaths": [
        "hardware/evt0/device-link-v1/schema.json",
        "hardware/evt0/device-link-v1/transaction-transcript.schema.json",
        "hardware/evt0/device-link-v1/transaction-golden.json",
        "hardware/evt0/device-link-v1/transaction-negative.json"
      ],
      "consumers": [
        "tools/device-link-sim",
        "firmware/crates/yimi-device-link-core"
      ],
      "conformanceGate": "npm run test:device-link-sim"
    },
    {
      "id": "family-repository-v1",
      "canonicalPaths": [
        "contracts/family-revision-v1.mjs",
        "contracts/rfc3339.mjs",
        "hardware/evt0/family-repository-v1/family-revision.schema.json",
        "hardware/evt0/family-repository-v1/build-request.schema.json",
        "hardware/evt0/family-repository-v1/repository-format.schema.json",
        "hardware/evt0/family-repository-v1/repository-state.schema.json",
        "hardware/evt0/family-repository-v1/repository-backup.schema.json",
        "hardware/evt0/family-repository-v1/repository-conformance.schema.json",
        "hardware/evt0/family-repository-v1/repository-conformance.json",
        "hardware/evt0/family-repository-v1/golden/family-revision.json",
        "hardware/evt0/family-repository-v1/golden/family-revision-2.json",
        "hardware/evt0/family-repository-v1/golden/family-revision-3.json",
        "hardware/evt0/family-repository-v1/golden/family-revision-3-alt.json",
        "hardware/evt0/family-repository-v1/golden/build-request.json",
        "contracts/family-build-plan-v1.mjs",
        "hardware/evt0/family-repository-v1/build-plan.schema.json",
        "hardware/evt0/family-repository-v1/build-authorization.schema.json",
        "hardware/evt0/family-repository-v1/golden/build-plan.json"
      ],
      "consumers": [
        "apps/companion-app",
        "tools/family-build-adapter",
        "tools/family-repository",
        "hardware/evt0/family-alpha-v1/golden/draft.json",
        "tools/confirmation-trust"
      ],
      "conformanceGate": "npm run validate:family-repository-contracts"
    },
    {
      "id": "authoring-product-session-v1",
      "canonicalPaths": [
        "apps/companion-app/src/authoring/authoring-contract.mjs",
        "apps/companion-app/src/authoring/authoring-product-session-core.mjs",
        "docs/authoring-product-shell-v1.md"
      ],
      "consumers": [
        "apps/companion-app/src/authoring/authoring-product-session.mjs",
        "apps/companion-app/src/authoring/family-workspace-authoring-adapter.mjs",
        "apps/companion-app/src/authoring/run-authoring-product-shell-acceptance.mjs"
      ],
      "conformanceGate": "npm run test:companion-authoring-product-shell"
    },
    {
      "id": "family-export-v1",
      "canonicalPaths": [
        "contracts/family-export-v1.mjs",
        "hardware/evt0/family-export-v1/family-export-manifest.schema.json"
      ],
      "consumers": [
        "apps/companion-app/src/local-family-export.mjs",
        "apps/companion-app/src/run-acceptance.mjs"
      ],
      "conformanceGate": "npm run test:companion-host"
    },
    {
      "id": "family-alpha-v1",
      "canonicalPaths": [